{
  "schema_version": "1.0",
  "exported_at": "2026-10-20",
  "unit": {"scale":1000000,"label":"millions of currency"},
  "club": {
    "id": "kryliasovetovsamara-ru",
    "name": "AO Professional Football Club Krylia Sovetov",
    "display_name": "Krylia Sovetov Samara",
    "country": "RU",
    "reporting_currency": "RUB",
    "fiscal_year_start": "01-01",
    "sport": "futbol"
  },
  "sources": [
    {
      "id": "kryliasovetovsamara-ru-bfo-2021-datos",
      "club_id": "kryliasovetovsamara-ru",
      "title": "AO Professional Football Club Krylia Sovetov — отчетность 2021 в ГИР БО (bo.nalog.gov.ru), ejercicio 2021",
      "type": "official_balance_sheet",
      "reliability": "primary"
    },
    {
      "id": "kryliasovetovsamara-ru-bfo-2022-datos",
      "club_id": "kryliasovetovsamara-ru",
      "title": "AO Professional Football Club Krylia Sovetov — отчетность 2022 в ГИР БО (bo.nalog.gov.ru), ejercicio 2022",
      "type": "official_balance_sheet",
      "reliability": "primary"
    },
    {
      "id": "kryliasovetovsamara-ru-bfo-2023-datos",
      "club_id": "kryliasovetovsamara-ru",
      "title": "AO Professional Football Club Krylia Sovetov — отчетность 2023 в ГИР БО (bo.nalog.gov.ru), ejercicio 2023",
      "type": "official_balance_sheet",
      "reliability": "primary"
    },
    {
      "id": "kryliasovetovsamara-ru-bfo-2024-datos",
      "club_id": "kryliasovetovsamara-ru",
      "title": "AO Professional Football Club Krylia Sovetov — отчетность 2024 в ГИР БО (bo.nalog.gov.ru), ejercicio 2024",
      "type": "official_balance_sheet",
      "reliability": "primary"
    },
    {
      "id": "kryliasovetovsamara-ru-bfo-2025-datos",
      "club_id": "kryliasovetovsamara-ru",
      "title": "AO Professional Football Club Krylia Sovetov — отчетность 2025 в ГИР БО (bo.nalog.gov.ru), ejercicio 2025",
      "type": "official_balance_sheet",
      "reliability": "primary"
    }
  ],
  "members": null,
  "years": [
    {
      "fiscal_year": 2021,
      "period_end": "2021-12-31",
      "currency": "RUB",
      "source_id": "kryliasovetovsamara-ru-bfo-2021-datos",
      "report_type": "official_balance_sheet",
      "management_id": null,
      "fx": {"ref":"RUB@2021-12-31"},
      "revenue": [
        {"label":"Выручка (2110)","category":"lump_football_operations","amount":241.394,"disclosure":"aggregated"},
        {"label":"Прочие доходы (2340)","category":"other_income","amount":1309.452,"disclosure":"aggregated"}
      ],
      "expenses": [
        {"label":"Себестоимость продаж (2120)","category":"lump_football_operations_expense","amount":-1508.704,"disclosure":"aggregated"},
        {"label":"Прочие расходы (2350)","category":"other_expenses","amount":-6.803,"disclosure":"aggregated"}
      ],
      "financial": {"profit_on_player_sales":0,"asset_sales":0,"net_interest":-31.57,"tax":-1.663,"gross_debt":987.452,"cash":57.062},
      "official_totals": {"revenue":null,"expenses":null,"net_result":2.106},
      "adjustments": {
        "extra_rows": [{"label":"Проценты к уплате (2330)","amount":-31.57},{"label":"Налог на прибыль и прочее (2300 − 2400)","amount":-1.663}],
        "no_breakdown": [
          {"line":"Выручка (2110)","side":"ingreso","amount":241.394,"reason":"el formulario 2 ruso no abre este renglón (bfo-rusia.mjs, escalón 1)"},
          {
            "line": "Себестоимость продаж (2120)",
            "side": "gasto",
            "amount": 1508.704,
            "reason": "el formulario 2 ruso no abre este renglón (bfo-rusia.mjs, escalón 1)"
          }
        ],
        "included_in": {
          "broadcasting": {"in":"lump_football_operations","possible":true},
          "matchday_competition": {"in":"lump_football_operations","possible":true},
          "member_dues": {"in":"lump_football_operations","possible":true},
          "sponsorship_commercial": {"in":"lump_football_operations","possible":true},
          "wages_squad": {"in":"lump_football_operations_expense","possible":true}
        }
      }
    },
    {
      "fiscal_year": 2022,
      "period_end": "2022-12-31",
      "currency": "RUB",
      "source_id": "kryliasovetovsamara-ru-bfo-2022-datos",
      "report_type": "official_balance_sheet",
      "management_id": null,
      "fx": {"ref":"RUB@2022-12-31"},
      "revenue": [
        {"label":"Выручка (2110)","category":"lump_football_operations","amount":686.891,"disclosure":"aggregated"},
        {"label":"Прочие доходы (2340)","category":"other_income","amount":2065.318,"disclosure":"aggregated"}
      ],
      "expenses": [
        {"label":"Себестоимость продаж (2120)","category":"lump_football_operations_expense","amount":-1993.276,"disclosure":"aggregated"},
        {"label":"Прочие расходы (2350)","category":"other_expenses","amount":-25.348,"disclosure":"aggregated"}
      ],
      "financial": {"profit_on_player_sales":0,"asset_sales":0,"net_interest":-4.662,"tax":-146.543,"gross_debt":992.114,"cash":602.997},
      "official_totals": {"revenue":null,"expenses":null,"net_result":582.38},
      "adjustments": {
        "extra_rows": [{"label":"Проценты к уплате (2330)","amount":-4.662},{"label":"Налог на прибыль и прочее (2300 − 2400)","amount":-146.543}],
        "no_breakdown": [
          {"line":"Выручка (2110)","side":"ingreso","amount":686.891,"reason":"el formulario 2 ruso no abre este renglón (bfo-rusia.mjs, escalón 1)"},
          {
            "line": "Себестоимость продаж (2120)",
            "side": "gasto",
            "amount": 1993.276,
            "reason": "el formulario 2 ruso no abre este renglón (bfo-rusia.mjs, escalón 1)"
          }
        ],
        "included_in": {
          "broadcasting": {"in":"lump_football_operations","possible":true},
          "matchday_competition": {"in":"lump_football_operations","possible":true},
          "member_dues": {"in":"lump_football_operations","possible":true},
          "sponsorship_commercial": {"in":"lump_football_operations","possible":true},
          "wages_squad": {"in":"lump_football_operations_expense","possible":true}
        }
      }
    },
    {
      "fiscal_year": 2023,
      "period_end": "2023-12-31",
      "currency": "RUB",
      "source_id": "kryliasovetovsamara-ru-bfo-2023-datos",
      "report_type": "official_balance_sheet",
      "management_id": null,
      "fx": {"ref":"RUB@2023-12-31"},
      "revenue": [
        {"label":"Выручка (2110)","category":"lump_football_operations","amount":902.657,"disclosure":"aggregated"},
        {"label":"Прочие доходы (2340)","category":"other_income","amount":1850.81,"disclosure":"aggregated"}
      ],
      "expenses": [
        {"label":"Себестоимость продаж (2120)","category":"lump_football_operations_expense","amount":-2387.252,"disclosure":"aggregated"},
        {"label":"Прочие расходы (2350)","category":"other_expenses","amount":-24.485,"disclosure":"aggregated"}
      ],
      "financial": {"profit_on_player_sales":0,"asset_sales":0,"net_interest":-4.498,"tax":-67.217,"gross_debt":929.945,"cash":242.55},
      "official_totals": {"revenue":null,"expenses":null,"net_result":270.015},
      "adjustments": {
        "extra_rows": [{"label":"Проценты к уплате (2330)","amount":-4.498},{"label":"Налог на прибыль и прочее (2300 − 2400)","amount":-67.217}],
        "no_breakdown": [
          {"line":"Выручка (2110)","side":"ingreso","amount":902.657,"reason":"el formulario 2 ruso no abre este renglón (bfo-rusia.mjs, escalón 1)"},
          {
            "line": "Себестоимость продаж (2120)",
            "side": "gasto",
            "amount": 2387.252,
            "reason": "el formulario 2 ruso no abre este renglón (bfo-rusia.mjs, escalón 1)"
          }
        ],
        "included_in": {
          "broadcasting": {"in":"lump_football_operations","possible":true},
          "matchday_competition": {"in":"lump_football_operations","possible":true},
          "member_dues": {"in":"lump_football_operations","possible":true},
          "sponsorship_commercial": {"in":"lump_football_operations","possible":true},
          "wages_squad": {"in":"lump_football_operations_expense","possible":true}
        }
      }
    },
    {
      "fiscal_year": 2024,
      "period_end": "2024-12-31",
      "currency": "RUB",
      "source_id": "kryliasovetovsamara-ru-bfo-2024-datos",
      "report_type": "official_balance_sheet",
      "management_id": null,
      "fx": {"ref":"RUB@2024-12-31"},
      "revenue": [
        {"label":"Выручка (2110)","category":"lump_football_operations","amount":809.104,"disclosure":"aggregated"},
        {"label":"Прочие доходы (2340)","category":"other_income","amount":1822.17,"disclosure":"aggregated"}
      ],
      "expenses": [
        {"label":"Себестоимость продаж (2120)","category":"lump_football_operations_expense","amount":-2216.984,"disclosure":"aggregated"},
        {"label":"Управленческие расходы (2220)","category":"admin_general_expense","amount":-120.141,"disclosure":"aggregated"},
        {"label":"Прочие расходы (2350)","category":"other_expenses","amount":-29.793,"disclosure":"aggregated"}
      ],
      "financial": {"profit_on_player_sales":0,"asset_sales":0,"net_interest":-4.343,"tax":-54.197,"gross_debt":934.288,"cash":525.069},
      "official_totals": {"revenue":null,"expenses":null,"net_result":205.816},
      "adjustments": {
        "extra_rows": [{"label":"Проценты к уплате (2330)","amount":-4.343},{"label":"Налог на прибыль и прочее (2300 − 2400)","amount":-54.197}],
        "no_breakdown": [
          {"line":"Выручка (2110)","side":"ingreso","amount":809.104,"reason":"el formulario 2 ruso no abre este renglón (bfo-rusia.mjs, escalón 1)"},
          {
            "line": "Себестоимость продаж (2120)",
            "side": "gasto",
            "amount": 2216.984,
            "reason": "el formulario 2 ruso no abre este renglón (bfo-rusia.mjs, escalón 1)"
          }
        ],
        "included_in": {
          "broadcasting": {"in":"lump_football_operations","possible":true},